{
  "schema_version": "1.0",
  "time": {"step_seconds": 86400, "timezone": "Asia/Shanghai", "timestamp_meaning": "interval_end"},
  "swat": {"profile": "source_port", "cn_mode": "dynamic", "channel_profile": "linear_storage", "soil_slug_mm": 1000.0, "cn_froz": 0.000862},
  "initial": {"soil_fraction": 0.5, "canopy_mm": 0.0, "surface_lag_mm": 0.0, "lateral_lag_mm": 0.0, "aquifer_storage_mm": 0.0, "aquifer_baseflow_mm": 0.0, "channel_storage_m3": 0.0},
  "reach_params_by_id": {"1": {"musk_k_hr": 18.0, "musk_x": 0.2, "ttime_hr": 18.0, "scoef": 1.0, "trans_loss_m3_day": 0.0, "evap_m3_day": 0.0}},
  "parameter_overrides": {},
  "warmup_steps": 30,
  "simulation": {"start": "2020-01-31T00:00:00+08:00", "end": "2020-12-31T00:00:00+08:00"}
}
